{
  "$schema": "https://json-schema.org/draft/2020-12/schema",
  "$id": "https://sustainablecatalyst.com/schemas/catalyst-analytics-r-indicator-v1.schema.json",
  "title": "Catalyst Analytics R Indicator Definition",
  "type": "object",
  "additionalProperties": false,
  "required": ["id", "version", "title", "description", "formula", "required_fields", "unit", "direction", "aggregation", "source", "targets", "metadata"],
  "properties": {
    "id": {"type": "string", "pattern": "^[a-z][a-z0-9_]*$"},
    "version": {"type": "string", "pattern": "^[0-9]+\\.[0-9]+\\.[0-9]+(?:[-+][A-Za-z0-9.-]+)?$"},
    "title": {"type": "string", "minLength": 1},
    "description": {"type": "string"},
    "formula": {"type": "string", "minLength": 1},
    "required_fields": {"type": "array", "minItems": 1, "uniqueItems": true, "items": {"type": "string", "minLength": 1}},
    "unit": {"type": "string", "minLength": 1},
    "direction": {"enum": ["higher_better", "lower_better", "contextual"]},
    "aggregation": {"enum": ["rowwise", "sum", "mean", "last_minus_first", "custom"]},
    "source": {"type": "object"},
    "targets": {"type": "array", "items": {"type": "object"}},
    "metadata": {"type": "object"}
  }
}
